title,company,salary,address,work_location,description
Staff Accountant,Pacific Sunwear Stores LLC,"$72,933 - $80,438 a year",,,"Join the Pacsun Community

Co-created in Los Angeles, Pacsun inspires the next generation of youth, building community at the intersection of fashion, music, art and sport. Pacsun is a leading lifestyle brand offering an exclusive collection of the most relevant brands and styles such as adidas, Brandy Melville, Essentials Fear of God, our own brands, and many more.

Our Pacsun community believes in and understands the importance of using our voice, platform, and resources to inspire and bring about positive development. Through our PacCares program, we are committed to our responsibility in using our platform to drive change and take action on the issues important to our community. Join the Pacsun Community.

Learn more here: LinkedIn- Our Community

About the Job:
Ensure accurate and timely capture of financial transactions from subsidiary systems and manual journal entries in the general ledger. Provide general ledger accounting support and reporting to internal (senior management, functional areas, and department heads) and external customers (external auditors).
A day in the life, what you’ll be doing:
Work collaboratively with internal stakeholders from different departments to understand and maintain accurate accrual and accounting.
Create journal entries and maintain G/L accounts accurately during the close process.
Develop and maintain excel reporting models including numerous spreadsheets which calculate journal entries for accruals, operating expenses, allocations, payroll and benefit adjustments, interest expense, and equity earnings.
Perform month-end, quarter-end, and year-end account reconciliations.
Develop and provide management reporting and information to internal customers (functional areas and department heads) and external customers (external auditors, census bureau).
Reconcile and analyze specific general ledger accounts.
Demonstrate flexibility in taking on ad-hoc projects
Assist external auditors with year-end financial statement audit
Maintain SOX compliance.
Assist with other financial reporting projects as needed.
Maintain knowledge of accounting policies and procedures.

What it takes to Join:
BA / BS in Accounting or Finance.
1-3 years of progressive accounting experience preferred. Will consider recent graduates.
Understanding of the relationship between various financial reports: Balance Sheet, Income Statement, and Cash Flow.
Understand the flow of financial information from transactions to reports.
Strong organizational skills and attention to detail.
Ability to communicate effectively with all staff levels in Finance / Accounting and other departments as required.
Ability to work independently, manage time well, and handle multiple projects and deadlines.
Ability to work remotely, collaborate and communicate using various tools.
Experience with Accounting software systems and proficiency in Excel. Excel Power Query, Infor Cloud Suite Financials, Microsoft Dynamics, and Blackline experience a plus.

Salary Range: $72,933 - $80,438

Pac Perks:
Dog friendly office environment
On-site Café
On-site Gym
$1,000 referral incentive program
Generous associate discount of 30-50% off merchandise online and in-stores
Competitive long term and short-term incentive program
Immediate 100% vested 401K contributions and employer match
Calm Premium access for all employees
Employee perks throughout the year

Physical Requirements:
The physical demands described here are representative of those that are required by an associate to successfully perform the essential functions of this job.
While performing the duties of this job, the associate is regularly required to talk or hear. The associate is frequently required to sit; stand; walk; use hands to finger, handle or feel; as well as reach with hands and arms.
Specific vision abilities required by this job include close vision, distance vision, depth perception and ability to adjust focus.
Ability to work in open environment with fluctuating temperatures and standard lighting.
Ability to work on computer and mobile phone for multiple hours; with frequent interruptions.
Required to travel in elevator or stairwells to attend meetings and engage with associates on multiple floors throughout building.
Hotel, Airplane, and Car Travel may be required.

Position Type/Expected Hours of Work:
This is a full-time position. As a National Retailer, occasional evening and/or weekend work may be required during periods of high volume. This role operates in a professional office environment and routinely uses standard office equipment.

Other Considerations:
Please note this job description is not designed to cover or contain a comprehensive listing of activities, duties or responsibilities that are required of the associate for this job. Duties, responsibilities and activities may change at any time with or without notice. Reasonable accommodations may be made to qualified individuals with disabilities to enable them to perform the essential functions of the role.
Equal Opportunity Employer
This employer is required to notify all applicants of their rights pursuant to federal employment laws. For further information, please review the Know Your Rights notice from the Department of Labor."
"Accountant, F&B",Honda Center,"$90,000 - $100,000 a year",,,"A great experience starts with you!
Honda Center welcomes fans, performers, and athletes from around the globe. Our team members are an integral part of the event experience through their interactions with guests. Whether you’re looking to create a great guest experience at a concert, support business growth and development, work behind-the-scenes during an Anaheim Ducks game, or anything in-between, this is your opportunity to start the next chapter of your career story and help create a one-of-a-kind fan experience at Honda Center.
Once you've had a chance to explore our current open positions, apply to the ones you feel best suit you, as an applicant, you can always see your application status in your profile.
Job Title:
Accountant, F&B
Pay Details:
The annual base salary range for this position in California is $90,000 to $100,000 per year. The starting pay for the successful candidate depends on various job-related factors, including but not limited to the candidate’s geographic location, job-related knowledge, skills, experience, education/training, internal value, peer equity, external market demands, and organizational considerations.
The Accountant supports daily financial operations, including revenue recording, reconciliations, accounts receivable/payable, and audit preparation. This role ensures accurate financial reporting and maintains organized fiscal records. This role requires 5-7 years of experience in accounting/finance.
Responsibilities
Review and reconcile POS sales reports and record revenue in the F&B general ledger according to appropriate sales categories, departments, and events
Reconcile daily settlements between POS reports and bank statements
Complete monthly bank reconciliations for all transactions across all bank accounts
Reconcile intercompany accounts
Oversee and maintain Accounts Receivable and provide regular updates to leadership on receivables status
Provide support to the Accounts Payable function
Contribute to the achievement of financial accounting objectives
Support financial audits by preparing required documentation, coordinating with auditors, and responding to audit inquiries in a timely and accurate manner
Assist in the preparation of monthly financial reports
Establish and maintain organized fiscal files and records to accurately document transactions
Assist with ad hoc reporting and special projects
Skills
Bachelor’s degree in accounting or a related field preferred
5-7 years of experience in accounting or finance
Experience in the food and beverage industry preferred
Proficiency in Microsoft Office applications (Word, Excel, Outlook) is a must
Knowledge of Microsoft Dynamics 365 F&O software is preferred
Proven knowledge of bookkeeping and accounting principles
Strong organizational skills
High attention to detail and accuracy
Excellent communication skills, both written and oral
Able to work efficiently and accurately, especially with deadlines
Able to manage a budget and work within the constraints of that budget
Able to define problems, collect data, establish facts, and draw valid conclusions
Able to take directions from multiple parties
Able to prioritize while handling multiple tasks
Knowledge, Skills and Experience
Education - Bachelor's Degree
Experience Required – 5+ Years
This position is on-site.
Company:
Anaheim Arena Management, LLC (F&B)
Our Commitment:
We are committed to providing an environment of mutual respect where equal employment opportunities are available to all applicants and team members without regard to race, color, religion, sex (including pregnancy and gender identity), national origin, political affiliation, sexual orientation, marital status, disability, genetic information, age, membership in an employee organization, parental status, military service, medical condition or any protected category prohibited by local, state or federal laws. We are firm believers that diversity and inclusion among our team members are critical to our success, and we seek to recruit, develop, and retain the most talented people from a diverse candidate pool.
If you like wild growth and working with happy, enthusiastic over-achievers, you'll enjoy your career with us!"
"TAX TECHNICIAN, FRANCHISE TAX BOARD",Franchise Tax Board,"$3,454 - $4,885 a month",,,"If you enjoy working in a team environment where you can apply your critical thinking, customer service, and analytical skills then we have the perfect opportunity for you. We are a team that provides excellent customer service to the public to help resolve their tax related issues. We are looking for a self-motivated individual who is responsible and enjoys mentoring and collaborating with others to join our team.

In your role, you will perform two essential aspects of the job. The first workload is to maintain an inventory of delinquent accounts and collect the proper amount of tax. The second workload is providing excellent customer service assisting our public counter.

In your customer service role, you will:

Assist customers pertaining to the collection and resolution of Personal Income Tax, Business Entity, and Non-Tax Debt accounts.

Assist customers in a professional manner.

Need to be able to work in a fast-paced environment, analyze documents thoroughly, explain applicable tax laws to taxpayers, and apply appropriate collection remedies to accounts.

Need to demonstrate a high degree of initiative, prudence, analytical ability, verbal as well as written communication skills, and be independent in decision making.

Work shifts are between the hours of 8:00 am and 5:00 pm, Monday through Friday.

Position(s) is located in the following office location:
Santa Ana
Additional positions may become available (eRPA 2425-00173).

Please complete this optional survey letting us know how you heard about this position by clicking here.

You will find additional information about the job in the Duty Statement.
Working Conditions
This position is eligible for limited remote working within California based on departmental guidelines and operational need. Once training is complete, FTB has a minimum in-office requirement of four days per week for all positions including those that are eligible for telework.
Minimum Requirements
You will find the Minimum Requirements in the Class Specification.
TAX TECHNICIAN, FRANCHISE TAX BOARD
Additional Documents
Job Application Package Checklist
Duty Statement
Position Details
Job Code #:
JC-469279
Position #(s):
564-663-7505-XXX
Working Title:
Tax Technician (Santa Ana Field Office)
Classification:
TAX TECHNICIAN, FRANCHISE TAX BOARD
$3,454.00 - $4,327.00 A
$3,900.00 - $4,885.00 B
# of Positions:
Multiple
Work Location:
Orange County
Telework:
Hybrid
Job Type:
Permanent, Full Time
Department Information
Our mission is to help taxpayers file timely and accurate tax returns, and pay the correct amount to fund services important to Californians.
FTB fosters an environment of equity and inclusion for all and we welcome everyone to be part of our diverse workforce.
Department Website: http://www.ftb.ca.gov
Special Requirements
The position(s) require(s) a Background Investigation be cleared prior to being hired.
This business uses E-Verify in its hiring practices to achieve a lawful workforce. E-Verify is a web-based system that allows enrolled employers to confirm the eligibility of their employees to work in the United States. For more information about E-Verify, please go to www.dhs.gov/e-verify.
CALIFORNIA CODE OF REGULATION, SECTION 172: All candidates for, appointees to, and employees in the state civil service shall possess the general qualifications of integrity, honesty, sobriety, dependability, industry, thoroughness, accuracy, good judgment, initiative, resourcefulness, courtesy, ability to work cooperatively with others, willingness and ability to assume the responsibilities and to conform to the conditions of work characteristic of the employment, and a state of health, consistent with the ability to perform the assigned duties of the class. Where the position requires the driving of an automobile, the employee must have a valid state driver's license, a good driving record and is expected to drive the car safely. The foregoing general qualifications shall be deemed to be a part of the personal characteristics of the minimum qualifications of each class specification and need not be specifically set forth therein.
**IMPORTANT NOTICE** As required by the department's rules of conduct, all employees of the Franchise Tax Board (FTB) must be in compliance with the California Revenue and Taxation Code. During the background investigation portion of the hiring process, FTB will review return information to verify California state income tax compliance. Any failure to comply with the California Revenue and Taxation Code may prevent you from being hired at FTB. You must verify your filing status by calling 1-800-852-5711 to resolve any potential tax compliance issues, prior to submitting your application and seeking employment with FTB. All applicants not currently employed with the Franchise Tax Board will be subject to a pre-employment background investigation. The investigation will consist of completion of a pre-employment questionnaire, fingerprinting, and an inquiry to the Department of Justice to disclose criminal records. We comply with the Americans with Disabilities Act. Persons with hearing or speech impairments, call TTY/TDD (800) 735-2929.
Application Instructions
Completed applications and all required documents must be received or postmarked by the Final Filing Date in order to be considered. Dates printed on Mobile Bar Codes, such as the Quick Response (QR) Codes available at the USPS, are not considered Postmark dates for the purpose of determining timely filing of an application.
Final Filing Date: 5/9/2025
Who May Apply
Individuals who are currently in the classification, eligible for lateral transfer, eligible for reinstatement, have list or LEAP eligibility, are in the process of obtaining list eligibility, or have SROA and/or Surplus eligibility (please attach your letter, if available). SROA and Surplus candidates are given priority; therefore, individuals with other eligibility may be considered in the event no SROA or Surplus candidates apply.

Applications will be screened and only the most qualified applicants will be selected to move forward in the selection process. Applicants must meet the Minimum Qualifications stated in the Classification Specification(s).
How To Apply
Complete Application Packages (including your Examination/Employment Application (STD 678) and applicable or required documents) must be submitted to apply for this Job Posting. Application Packages may be submitted electronically through your CalCareer Account at www.CalCareers.ca.gov. When submitting your application in hard copy, a completed copy of the Application Package listing must be included. If you choose to not apply electronically, a hard copy application package may be submitted through an alternative method listed below:
Address for Mailing Application Packages
You may submit your application and any applicable or required documents to:

Franchise Tax Board
Classification and Hiring Unit
Attn: Kiley Randell
P.O. Box 550
Sacramento, CA 95812-0550
Address for Drop-Off Application Packages
You may drop off your application and any applicable or required documents at:

Franchise Tax Board
Classification and Hiring Unit
ATTN: Kiley Randell
9646 Butterfield Way
Sacramento, CA 95827
Drop off at Welcome Center in Main Lobby (may be non-operational on weekends and holidays)
07:00 AM - 06:00 PM
Required Application Package Documents
The following items are required to be submitted with your application. Applicants who do not submit the required items timely may not be considered for this job:
Current version of the State Examination/Employment Application STD Form 678 (when not applying electronically), or the Electronic State Employment Application through your Applicant Account at www.CalCareers.ca.gov. All Experience and Education relating to the Minimum Qualifications listed on the Classification Specification should be included to demonstrate how you meet the Minimum Qualifications for the position.
Resume is required and must be included.
Applicants requiring reasonable accommodations for the hiring interview process must request the necessary accommodations if scheduled for a hiring interview. The request should be made at the time of contact to schedule the interview. Questions regarding reasonable accommodations may be directed to the EEO contact listed on this job posting.
Desirable Qualifications
In addition to evaluating each candidate's relative ability, as demonstrated by quality and breadth of experience, the following factors will provide the basis for competitively evaluating each candidate:
In addition to evaluating each candidate's relative ability, as demonstrated by quality and breadth of experience, the following factors will provide the basis for competitively evaluating each candidate:

We encourage you to apply regardless of if you meet 100% of the skills below. Please highlight your knowledge, skills, and experience related to these desirable qualifications in your application package:

Knowledge of the PC, including Microsoft Excel and Word applications.
Excellent interpersonal and customer service skills.
Ability to effectively deal face to face with the public and establish and maintain positive working relationships.
Ability to handle changing priorities and work under pressure.
Excellent communication skills, both verbal and written.
Willingness to adjust work schedule to meet operational needs.
Strong organizational and multi-tasking skills.
Ability to effectively work independently and in a team environment.
Knowledge of Taxpayer Information (TI), Business Entities Tax System (BETS), Accounts Receivable Collection System (ARCS), Business Entities (BE) ARCS, Taxpayer Folder (TPF), and Case Management (CM).
A two-year degree or equivalent.
Benefits
Benefit information can be found on the CalHR website and the CalPERS website.
Contact Information
The Human Resources Contact is available to answer questions regarding the application process. The Hiring Unit Contact is available to answer questions regarding the position.
Department Website: http://www.ftb.ca.gov
Human Resources Contact:
Classification & Hiring Unit
(916) 845-3608
Hiring Unit Contact:
Kiley Randell
(619) 688-2579 ext:
Kiley.Randell@ftb.ca.gov
Please direct requests for Reasonable Accommodations to the interview scheduler at the time the interview is being scheduled. You may direct any additional questions regarding Reasonable Accommodations or Equal Employment Opportunity for this position(s) to the Department's EEO Office.
EEO Contact:
EEO Office
(916) 845-2860
California Relay Service: 1-800-735-2929 (TTY), 1-800-735-2922 (Voice) TTY is a Telecommunications Device for the Deaf, and is reachable only from phones equipped with a TTY Device.
Additional Application Instructions
A complete application package must be received in the Classification & Hiring Unit or postmarked by the final filing date and must include:
Completed employment information on the STD. 678, including the “From” and “To” dates, “Hours Per Week,” and “Duties Performed"" fields for all jobs listed in the “Employment History” fields (resumes do not take the place of these fields on the STD. 678)
All of the required documents listed in the “Required Application Package Documents” section
The position number and job control number in the job title line of the STD. 678, if submitting a paper application package (these numbers will auto-populate in the job title line of the STD. 678 if submitting an electronic application through your CalCareer Account)
A signature, if submitting a paper application package
Candidates who do not follow all of the listed application instructions may be eliminated from the selection process. All submitted information will be screened and the most qualified candidates will be invited to an interview.
Electronic applications submitted through your CalCareer Account are highly recommended. If you are unable to apply electronically through your CalCareer account, please mail a completed and signed STD. 678 and application package to the mailing address provided above in the “Application Instructions” section.
Do not include full Social Security Number, method of eligibility, and LEAP information in your application package.
Examination Information
To apply for the Tax Technician position(s) as a list candidate, you must first take the online Tax Technician, Franchise Tax Board examination.
Equal Opportunity Employer
The State of California is an equal opportunity employer to all, regardless of age, ancestry, color, disability (mental and physical), exercising the right to family care and medical leave, gender, gender expression, gender identity, genetic information, marital status, medical condition, military or veteran status, national origin, political affiliation, race, religious creed, sex (includes pregnancy, childbirth, breastfeeding and related medical conditions), and sexual orientation.
It is an objective of the State of California to achieve a drug-free work place. Any applicant for state employment will be expected to behave in accordance with this objective because the use of illegal drugs is inconsistent with the law of the State, the rules governing Civil Service, and the special trust placed in public servants."
